{
  "$schema": "http://json-schema.org/draft-07/schema#",
  "type": "object",
  "title": "ManufacturingFacility",
  "properties": {
    "name": {
      "type": "string"
    },
    "location": {
      "type": "object",
      "title": "Location",
      "properties": {},
      "required": []
    },
    "facility_status": {
      "type": "string",
      "enum": [
        "Active",
        "Planned",
        "Temporary Closure",
        "Closed"
      ]
    },
    "id": {
      "type": "string",
      "format": "uuid"
    },
    "owner": {
      "type": "object",
      "title": "Agent",
      "properties": {},
      "required": []
    },
    "contact": {
      "type": "object",
      "title": "Agent",
      "properties": {},
      "required": []
    },
    "affiliations": {
      "type": "array",
      "items": {
        "type": "object",
        "title": "Agent",
        "properties": {},
        "required": []
      }
    },
    "opening_hours": {
      "type": "string"
    },
    "description": {
      "type": "string"
    },
    "date_founded": {
      "type": "string",
      "format": "date"
    },
    "access_type": {
      "type": "string",
      "enum": [
        "Restricted",
        "Restricted with public hours",
        "Shared space",
        "Public",
        "Membership"
      ]
    },
    "wheelchair_accessibility": {
      "type": "string"
    },
    "equipment": {
      "type": "array",
      "items": {
        "type": "object",
        "title": "Equipment",
        "properties": {},
        "required": []
      }
    },
    "manufacturing_processes": {
      "type": "array",
      "items": {
        "type": "string"
      }
    },
    "typical_batch_size": {
      "type": "string",
      "enum": [
        "0 -- 50 units",
        "50 -- 500 units",
        "500 -- 5000 units",
        "5000 + units"
      ]
    },
    "floor_size": {
      "type": "integer"
    },
    "storage_capacity": {
      "type": "string"
    },
    "typical_materials": {
      "type": "array",
      "items": {
        "type": "object",
        "title": "Material",
        "properties": {},
        "required": []
      }
    },
    "certifications": {
      "type": "array",
      "items": {
        "type": "string"
      }
    },
    "backup_generator": {
      "type": "boolean"
    },
    "uninterrupted_power_supply": {
      "type": "boolean"
    },
    "road_access": {
      "type": "boolean"
    },
    "loading_dock": {
      "type": "boolean"
    },
    "maintenance_schedule": {
      "type": "string"
    },
    "typical_products": {
      "type": "array",
      "items": {
        "type": "string"
      }
    },
    "partners_funders": {
      "type": "array",
      "items": {
        "type": "object",
        "title": "Agent",
        "properties": {},
        "required": []
      }
    },
    "customer_reviews": {
      "type": "array",
      "items": {
        "type": "string"
      }
    },
    "circular_economy": {
      "type": "object",
      "title": "CircularEconomy",
      "properties": {},
      "required": []
    },
    "human_capacity": {
      "type": "object",
      "title": "HumanCapacity",
      "properties": {},
      "required": []
    },
    "innovation_space": {
      "type": "object",
      "title": "InnovationSpace",
      "properties": {},
      "required": []
    },
    "record_data": {
      "type": "object",
      "title": "RecordData",
      "properties": {},
      "required": []
    }
  },
  "required": [
    "name",
    "location",
    "facility_status"
  ],
  "description": "Primary OKW Manufacturing Facility class"
}