{"id": "09167275-dc84-42a9-9642-ff24a6666ad7", "name": "Precision Machining Facility 1", "location": {"address": {"number": "9033", "street": "David Vista", "city": "New York", "region": "NH", "country": "US", "postcode": "91707"}, "gps_coordinates": "40.7127281, -74.0060152", "city": "New York", "country": "US"}, "facility_status": "Active", "opening_hours": "Mon-Fri: 7:00-20:00", "description": "Specialized in high-precision machining operations", "access_type": "Restricted", "equipment": [{"equipment_type": "https://en.wikipedia.org/wiki/CNC_mill", "manufacturing_process": "https://en.wikipedia.org/wiki/Machining", "make": "Tormach", "model": "PCNC 440", "serial_number": "SN349704", "condition": "Fair", "notes": "Equipment notes: Worker well as goal trade.", "throughput": "49 parts/hour", "power_rating": 7195, "tolerance_class": "ISO 2768-f", "computer_controlled": true, "materials_worked": [{"material_type": "https://en.wikipedia.org/wiki/Aluminum", "brand": "Standard", "supplier_location": {"address": {"number": "2442", "street": "Cody Landing", "city": "San Francisco", "region": "NV", "country": "US", "postcode": "57299"}, "gps_coordinates": "37.7879363, -122.4075201", "directions": "Located near Townsend-Pratt", "city": "San Francisco", "country": "US"}}, {"material_type": "https://en.wikipedia.org/wiki/Steel", "manufacturer": "Brand A", "brand": "Professional", "supplier_location": {"address": {"number": "4260", "street": "Wallace Islands", "city": "Charlotte", "region": "ID", "country": "US", "postcode": "27747"}, "gps_coordinates": "35.2272086, -80.8430827", "directions": "Located across from Carroll Ltd", "city": "Charlotte", "country": "US"}}, {"material_type": "https://en.wikipedia.org/wiki/Plastic", "brand": "Industrial", "supplier_location": {"address": {"number": "7174", "street": "Rebecca Well", "city": "Charlotte", "region": "NV", "country": "US", "postcode": "84293"}, "gps_coordinates": "35.2272086, -80.8430827", "directions": "Located behind Carey, Ramirez and Morales", "city": "Charlotte", "country": "US"}}, {"material_type": "https://en.wikipedia.org/wiki/Wood", "manufacturer": "Premium", "supplier_location": {"address": {"number": "3012", "street": "Velazquez Bypass", "city": "Indianapolis", "region": "CA", "country": "US", "postcode": "29008"}, "gps_coordinates": "39.7683331, -86.1583502", "city": "Indianapolis", "country": "US"}}], "axes": 4, "working_surface": 800}, {"equipment_type": "https://en.wikipedia.org/wiki/CNC_lathe", "manufacturing_process": "https://en.wikipedia.org/wiki/CNC_lathe", "make": "Brand B", "model": "Model 728", "condition": "Excellent", "computer_controlled": true}, {"equipment_type": "https://en.wikipedia.org/wiki/Surface_grinder", "manufacturing_process": "https://en.wikipedia.org/wiki/Surface_grinder", "make": "Brand A", "model": "Model 198", "condition": "Good"}, {"equipment_type": "https://en.wikipedia.org/wiki/CMM", "manufacturing_process": "https://en.wikipedia.org/wiki/CMM", "make": "Generic", "model": "Model 267", "condition": "Excellent", "computer_controlled": true}], "manufacturing_processes": ["https://en.wikipedia.org/wiki/Machining", "https://en.wikipedia.org/wiki/Deburring", "https://en.wikipedia.org/wiki/Surface_finish", "https://en.wikipedia.org/wiki/Quality_control"], "typical_batch_size": "0 -- 50 units", "floor_size": 3633, "typical_materials": [], "certifications": [], "backup_generator": true, "road_access": true, "loading_dock": true, "maintenance_schedule": "Every 5 months"}