{
  "id": "bfe5defd-700a-422d-9fdd-9b548426fc6c",
  "name": "Professional Machine Shop",
  "location": {
    "address": {
      "number": "4567",
      "street": "Seth Island",
      "city": "Columbus",
      "region": "DE",
      "country": "US",
      "postcode": "53146"
    },
    "gps_coordinates": "39.9622601, -83.0007065",
    "city": "Columbus",
    "country": "US"
  },
  "facility_status": "Active",
  "owner": {
    "name": "Hawkins, Burns and Wilkinson",
    "mailing_list": "meghanevans@lists.russell.biz",
    "images": [
      "images/focus.jpg",
      "images/cover.jpg",
      "images/nation.jpg"
    ],
    "contact": {
      "mobile": "+1-417-962-5023"
    },
    "social_media": {
      "facebook": "https://facebook.com/xballard",
      "instagram": "@williamcortez",
      "other_urls": []
    }
  },
  "opening_hours": "Mon-Fri: 7:00-21:00",
  "description": "Commercial machining facility with precision equipment",
  "date_founded": "2003-06-01",
  "access_type": "Restricted",
  "equipment": [
    {
      "equipment_type": "https://en.wikipedia.org/wiki/CNC_mill",
      "manufacturing_process": "https://en.wikipedia.org/wiki/Machining",
      "make": "Tormach",
      "model": "VF-2",
      "condition": "Good",
      "notes": "Equipment notes: Up agent about word east pass kid.",
      "throughput": "42 parts/hour",
      "power_rating": 7925,
      "tolerance_class": "ISO 2768-c",
      "computer_controlled": true,
      "extraction_system": true,
      "materials_worked": [
        {
          "material_type": "https://en.wikipedia.org/wiki/Aluminum",
          "brand": "Industrial",
          "supplier_location": {
            "address": {
              "number": "2141",
              "street": "Montes Stravenue",
              "city": "Boston",
              "region": "VI",
              "country": "US",
              "postcode": "56474"
            },
            "gps_coordinates": "42.3588336, -71.0578303",
            "directions": "Located across from Barnett Inc",
            "city": "Boston",
            "country": "US"
          }
        },
        {
          "material_type": "https://en.wikipedia.org/wiki/Steel",
          "brand": "Professional"
        },
        {
          "material_type": "https://en.wikipedia.org/wiki/Plastic",
          "manufacturer": "Brand A",
          "brand": "Standard",
          "supplier_location": {
            "address": {
              "number": "9740",
              "street": "Marilyn Route",
              "city": "Denver",
              "region": "KS",
              "country": "US",
              "postcode": "16202"
            },
            "gps_coordinates": "39.7392364, -104.984862",
            "city": "Denver",
            "country": "US"
          }
        },
        {
          "material_type": "https://en.wikipedia.org/wiki/Wood"
        }
      ],
      "axes": 5,
      "working_surface": 600,
      "detailed_capabilities": {
        "tolerance": "±0.01mm",
        "surface_finish": "Ra 0.8-3.2μm",
        "spindle_speed": "1000-12000 RPM",
        "feed_rate": "100-2000 mm/min",
        "tool_changer": "Automatic",
        "tolerance_range": "±0.015mm",
        "supported_materials": [
          "Plastic",
          "Wood"
        ],
        "process_parameters": {
          "setup_time": "93 minutes",
          "cycle_time": "35 minutes",
          "changeover_time": "36 minutes"
        }
      }
    },
    {
      "equipment_type": "https://en.wikipedia.org/wiki/CNC_lathe",
      "manufacturing_process": "https://en.wikipedia.org/wiki/CNC_lathe",
      "make": "Brand A",
      "model": "Model 607",
      "condition": "Excellent",
      "computer_controlled": true
    },
    {
      "equipment_type": "https://en.wikipedia.org/wiki/Surface_grinder",
      "manufacturing_process": "https://en.wikipedia.org/wiki/Surface_grinder",
      "make": "Generic",
      "model": "Model 902",
      "condition": "Excellent"
    }
  ],
  "manufacturing_processes": [
    "https://en.wikipedia.org/wiki/CNC_mill",
    "https://en.wikipedia.org/wiki/CNC_lathe",
    "https://en.wikipedia.org/wiki/Surface_grinder"
  ],
  "typical_batch_size": "50 -- 500 units",
  "floor_size": 4272,
  "storage_capacity": "930 cubic meters",
  "typical_materials": [],
  "certifications": [
    "ISO 9001",
    "AS9100"
  ],
  "uninterrupted_power_supply": true,
  "road_access": true,
  "maintenance_schedule": "Every 4 months"
}