{
  "id": "4bc7921f-f610-414c-991e-2694085227b1",
  "name": "Community Makerspace",
  "location": {
    "address": {
      "number": "4355",
      "street": "Avila Fort",
      "city": "San Jose",
      "region": "DC",
      "country": "US",
      "postcode": "60658"
    },
    "gps_coordinates": "37.3361663, -121.890591",
    "city": "San Jose",
    "country": "US"
  },
  "facility_status": "Planned",
  "owner": {
    "name": "Wang, Gonzalez and Estrada",
    "location": {
      "address": {
        "number": "3736",
        "street": "Buckley Fort",
        "city": "Dallas",
        "region": "MI",
        "country": "US",
        "postcode": "60125"
      },
      "gps_coordinates": "32.7762719, -96.7968559",
      "city": "Dallas",
      "country": "US"
    },
    "website": "https://adams.com",
    "images": [
      "images/song.jpg",
      "images/PM.jpg"
    ],
    "contact": {
      "landline": "+1-776-400-4676",
      "mobile": "+1-791-896-7666",
      "email": "info@richardson-davis.org",
      "whatsapp": "+1-762-898-1761"
    },
    "social_media": {
      "twitter": "@richardoconnor",
      "instagram": "@mooreeddie",
      "other_urls": [
        "https://herrera.biz"
      ]
    }
  },
  "description": "Public makerspace with basic fabrication equipment",
  "access_type": "Membership",
  "equipment": [
    {
      "equipment_type": "https://en.wikipedia.org/wiki/3D_printer",
      "manufacturing_process": "https://en.wikipedia.org/wiki/Fused_filament_fabrication",
      "make": "Ultimaker",
      "model": "Ender 3",
      "serial_number": "SN761449",
      "condition": "Excellent",
      "notes": "Equipment notes: Voice member material thousand voice project.",
      "quantity": 3,
      "throughput": "14 parts/hour",
      "maintenance_schedule": "Every 1 months",
      "usage_levels": "High",
      "tolerance_class": "ISO 2768-f",
      "computer_controlled": true,
      "materials_worked": [
        {
          "material_type": "https://en.wikipedia.org/wiki/PLA"
        },
        {
          "material_type": "https://en.wikipedia.org/wiki/PETG",
          "brand": "Professional"
        },
        {
          "material_type": "https://en.wikipedia.org/wiki/ABS"
        },
        {
          "material_type": "https://en.wikipedia.org/wiki/TPU",
          "manufacturer": "Premium",
          "brand": "Industrial",
          "supplier_location": {
            "address": {
              "number": "7410",
              "street": "Melissa Expressway",
              "city": "San Francisco",
              "region": "AK",
              "country": "US",
              "postcode": "22934"
            },
            "gps_coordinates": "37.7879363, -122.4075201",
            "city": "San Francisco",
            "country": "US"
          }
        }
      ],
      "build_volume": 27000000,
      "nozzle_size": 0.8
    },
    {
      "equipment_type": "https://en.wikipedia.org/wiki/Laser_cutter",
      "manufacturing_process": "https://en.wikipedia.org/wiki/Laser_cutting",
      "make": "Trotec",
      "model": "LS-1630",
      "serial_number": "SN207830",
      "condition": "Fair",
      "notes": "Equipment notes: Specific under financial friend.",
      "maintenance_schedule": "Every 2 months",
      "tolerance_class": "ISO 2768-m",
      "computer_controlled": true,
      "materials_worked": [
        {
          "material_type": "https://en.wikipedia.org/wiki/Acrylic",
          "manufacturer": "Brand B",
          "supplier_location": {
            "address": {
              "number": "7653",
              "street": "Hill Vista",
              "city": "Dallas",
              "region": "VA",
              "country": "US",
              "postcode": "64692"
            },
            "gps_coordinates": "32.7762719, -96.7968559",
            "directions": "Located across from Waters Inc",
            "city": "Dallas",
            "country": "US"
          }
        },
        {
          "material_type": "https://en.wikipedia.org/wiki/Wood"
        },
        {
          "material_type": "https://en.wikipedia.org/wiki/Fabric",
          "supplier_location": {
            "address": {
              "number": "238",
              "street": "Angel Mall",
              "city": "Houston",
              "region": "PW",
              "country": "US",
              "postcode": "53092"
            },
            "gps_coordinates": "29.7589382, -95.3676974",
            "city": "Houston",
            "country": "US"
          }
        },
        {
          "material_type": "https://en.wikipedia.org/wiki/Leather",
          "brand": "Industrial",
          "supplier_location": {
            "address": {
              "number": "187",
              "street": "Hunter Ridge",
              "city": "New York",
              "region": "SC",
              "country": "US",
              "postcode": "99312"
            },
            "gps_coordinates": "40.7127281, -74.0060152",
            "city": "New York",
            "country": "US"
          }
        }
      ],
      "laser_power": 100,
      "working_surface": 900
    },
    {
      "equipment_type": "https://en.wikipedia.org/wiki/CNC_router",
      "manufacturing_process": "https://en.wikipedia.org/wiki/CNC_router",
      "make": "Onefinity",
      "model": "XXL",
      "condition": "Excellent",
      "notes": "Equipment notes: Onto step wall one range themselves field.",
      "quantity": 3,
      "throughput": "72 parts/hour",
      "power_rating": 3949,
      "computer_controlled": true,
      "materials_worked": [
        {
          "material_type": "https://en.wikipedia.org/wiki/Wood",
          "manufacturer": "Premium"
        },
        {
          "material_type": "https://en.wikipedia.org/wiki/Plastic",
          "manufacturer": "Brand A",
          "supplier_location": {
            "address": {
              "number": "4473",
              "street": "Butler Stream",
              "city": "Columbus",
              "region": "PW",
              "country": "US",
              "postcode": "77390"
            },
            "gps_coordinates": "39.9622601, -83.0007065",
            "city": "Columbus",
            "country": "US"
          }
        },
        {
          "material_type": "https://en.wikipedia.org/wiki/Aluminum"
        },
        {
          "material_type": "https://en.wikipedia.org/wiki/Foam"
        }
      ],
      "axes": 4,
      "working_surface": 1200
    }
  ],
  "manufacturing_processes": [
    "https://en.wikipedia.org/wiki/3D_printer",
    "https://en.wikipedia.org/wiki/Laser_cutter",
    "https://en.wikipedia.org/wiki/CNC_router"
  ],
  "typical_batch_size": "0 -- 50 units",
  "storage_capacity": "190 cubic meters",
  "typical_materials": [],
  "certifications": [
    "Basic Safety"
  ],
  "backup_generator": true,
  "uninterrupted_power_supply": true,
  "road_access": true,
  "loading_dock": true,
  "circular_economy": {
    "applies_principles": true,
    "by_products": [
      "head",
      "simple"
    ]
  },
  "record_data": {
    "date_created": "2026-04-04T18:25:59.696759",
    "created_by": {
      "name": "Peterson and Sons",
      "languages": [
        "de",
        "fr"
      ],
      "mailing_list": "bbray@lists.buckley-hall.com",
      "social_media": {
        "twitter": "@david89",
        "instagram": "@marissa17",
        "other_urls": [
          "https://poole.com"
        ]
      }
    },
    "data_collection_method": "Website"
  }
}